{
  "$schema": "https://json-schema.org/draft/2020-12/schema",
  "$id": "https://kujolang.ai/contracts/publishing-house/resume-request.v1",
  "title": "publishing-house.resume-request/v1",
  "type": "object",
  "required": [
    "contract",
    "schema_name",
    "schema_version",
    "workflow_id",
    "workflow_version",
    "run_id",
    "correlation_id",
    "resumed_at",
    "actor",
    "decision_record_reference",
    "expected_pause_checksum"
  ],
  "properties": {
    "contract": {
      "const": "publishing-house.resume-request/v1"
    },
    "schema_name": {
      "const": "publishing-house.resume-request"
    },
    "schema_version": {
      "const": "1.0.0"
    },
    "workflow_id": {
      "type": "string"
    },
    "workflow_version": {
      "type": "string"
    },
    "run_id": {
      "type": "string"
    },
    "correlation_id": {
      "type": "string"
    },
    "resumed_at": {
      "type": "string"
    },
    "actor": {
      "type": "string"
    },
    "decision_record_reference": {
      "type": "object"
    },
    "expected_pause_checksum": {
      "type": "string"
    }
  },
  "additionalProperties": true
}
